{
  "schema_version": 1,
  "tracewhy_version": "1.0.0",
  "comparison_id": "comparison-f6af6080336a059b",
  "created_at": "2026-07-13T12:07:40.740Z",
  "good": {
    "name": "good",
    "command": "/workspace/demos/permission-denied/.build/permission-reader",
    "args": [
      "/workspace/demos/permission-denied/locked.txt"
    ],
    "cwd": "/workspace",
    "exit": {
      "code": 0,
      "success": true
    },
    "system": {
      "platform": "linux",
      "kernel": "Linux 6.12.76-linuxkit",
      "architecture": "aarch64",
      "distribution": "Debian GNU/Linux 12 (bookworm)",
      "libc": "ldd (Debian GLIBC 2.36-9+deb12u14) 2.36"
    },
    "warnings": []
  },
  "bad": {
    "name": "bad",
    "command": "/workspace/demos/permission-denied/.build/permission-reader",
    "args": [
      "/workspace/demos/permission-denied/locked.txt"
    ],
    "cwd": "/workspace",
    "exit": {
      "code": 77,
      "success": false
    },
    "system": {
      "platform": "linux",
      "kernel": "Linux 6.12.76-linuxkit",
      "architecture": "aarch64",
      "distribution": "Debian GNU/Linux 12 (bookworm)",
      "libc": "ldd (Debian GLIBC 2.36-9+deb12u14) 2.36"
    },
    "warnings": []
  },
  "findings": [
    {
      "finding_id": "permission_problem:-PROJECT-demos-permission-denied-locked.txt-p1",
      "type": "permission_problem",
      "title": "Permission blocks access to locked.txt",
      "classification": "likely_cause",
      "confidence": "high",
      "score": 95,
      "summary": "openat succeeds for `$PROJECT/demos/permission-denied/locked.txt` in the good run but returns EACCES in the bad run.",
      "reasons": [
        "The operation succeeds in the good run and fails in the bad run.",
        "The bad run returned EACCES.",
        "The resource is referenced in captured error output."
      ],
      "good_event_ids": [
        "good:7"
      ],
      "bad_event_ids": [
        "bad:7"
      ]
    }
  ],
  "events": {
    "good": [
      {
        "schema_version": 1,
        "event_id": "good:1",
        "process_id": "p1",
        "sequence": 1,
        "category": "executable",
        "operation": "execve",
        "resource": "$PROJECT/demos/permission-denied/.build/permission-reader",
        "result": {
          "kind": "success",
          "value": "0"
        },
        "raw_ref": {
          "file": "trace.136",
          "line": 1
        }
      },
      {
        "schema_version": 1,
        "event_id": "good:2",
        "process_id": "p1",
        "sequence": 2,
        "category": "library",
        "operation": "faccessat",
        "resource": "/etc/ld.so.preload",
        "result": {
          "kind": "error",
          "code": "ENOENT"
        },
        "details": {
          "dirfd": "AT_FDCWD"
        },
        "raw_ref": {
          "file": "trace.136",
          "line": 2
        }
      },
      {
        "schema_version": 1,
        "event_id": "good:3",
        "process_id": "p1",
        "sequence": 3,
        "category": "library",
        "operation": "openat",
        "resource": "/etc/ld.so.cache",
        "result": {
          "kind": "success",
          "value": "3"
        },
        "details": {
          "dirfd": "AT_FDCWD"
        },
        "raw_ref": {
          "file": "trace.136",
          "line": 3
        }
      },
      {
        "schema_version": 1,
        "event_id": "good:4",
        "process_id": "p1",
        "sequence": 4,
        "category": "library",
        "operation": "newfstatat",
        "resource": "/etc/ld.so.cache",
        "result": {
          "kind": "success",
          "value": "0"
        },
        "details": {
          "dirfd": "3",
          "path_was_relative": true
        },
        "raw_ref": {
          "file": "trace.136",
          "line": 4
        }
      },
      {
        "schema_version": 1,
        "event_id": "good:5",
        "process_id": "p1",
        "sequence": 5,
        "category": "library",
        "operation": "openat",
        "resource": "/lib/aarch64-linux-gnu/libc.so.6",
        "result": {
          "kind": "success",
          "value": "3"
        },
        "details": {
          "dirfd": "AT_FDCWD"
        },
        "raw_ref": {
          "file": "trace.136",
          "line": 5
        }
      },
      {
        "schema_version": 1,
        "event_id": "good:6",
        "process_id": "p1",
        "sequence": 6,
        "category": "library",
        "operation": "newfstatat",
        "resource": "/lib/aarch64-linux-gnu/libc.so.6",
        "result": {
          "kind": "success",
          "value": "0"
        },
        "details": {
          "dirfd": "3",
          "path_was_relative": true
        },
        "raw_ref": {
          "file": "trace.136",
          "line": 6
        }
      },
      {
        "schema_version": 1,
        "event_id": "good:7",
        "process_id": "p1",
        "sequence": 7,
        "category": "file",
        "operation": "openat",
        "resource": "$PROJECT/demos/permission-denied/locked.txt",
        "result": {
          "kind": "success",
          "value": "3"
        },
        "details": {
          "dirfd": "AT_FDCWD"
        },
        "raw_ref": {
          "file": "trace.136",
          "line": 7
        }
      },
      {
        "schema_version": 1,
        "event_id": "good:8",
        "process_id": "p1",
        "sequence": 8,
        "category": "process",
        "operation": "exit_group",
        "result": {
          "kind": "success",
          "value": "0"
        },
        "raw_ref": {
          "file": "trace.136",
          "line": 9
        }
      }
    ],
    "bad": [
      {
        "schema_version": 1,
        "event_id": "bad:1",
        "process_id": "p1",
        "sequence": 1,
        "category": "executable",
        "operation": "execve",
        "resource": "$PROJECT/demos/permission-denied/.build/permission-reader",
        "result": {
          "kind": "success",
          "value": "0"
        },
        "raw_ref": {
          "file": "trace.160",
          "line": 1
        }
      },
      {
        "schema_version": 1,
        "event_id": "bad:2",
        "process_id": "p1",
        "sequence": 2,
        "category": "library",
        "operation": "faccessat",
        "resource": "/etc/ld.so.preload",
        "result": {
          "kind": "error",
          "code": "ENOENT"
        },
        "details": {
          "dirfd": "AT_FDCWD"
        },
        "raw_ref": {
          "file": "trace.160",
          "line": 2
        }
      },
      {
        "schema_version": 1,
        "event_id": "bad:3",
        "process_id": "p1",
        "sequence": 3,
        "category": "library",
        "operation": "openat",
        "resource": "/etc/ld.so.cache",
        "result": {
          "kind": "success",
          "value": "3"
        },
        "details": {
          "dirfd": "AT_FDCWD"
        },
        "raw_ref": {
          "file": "trace.160",
          "line": 3
        }
      },
      {
        "schema_version": 1,
        "event_id": "bad:4",
        "process_id": "p1",
        "sequence": 4,
        "category": "library",
        "operation": "newfstatat",
        "resource": "/etc/ld.so.cache",
        "result": {
          "kind": "success",
          "value": "0"
        },
        "details": {
          "dirfd": "3",
          "path_was_relative": true
        },
        "raw_ref": {
          "file": "trace.160",
          "line": 4
        }
      },
      {
        "schema_version": 1,
        "event_id": "bad:5",
        "process_id": "p1",
        "sequence": 5,
        "category": "library",
        "operation": "openat",
        "resource": "/lib/aarch64-linux-gnu/libc.so.6",
        "result": {
          "kind": "success",
          "value": "3"
        },
        "details": {
          "dirfd": "AT_FDCWD"
        },
        "raw_ref": {
          "file": "trace.160",
          "line": 5
        }
      },
      {
        "schema_version": 1,
        "event_id": "bad:6",
        "process_id": "p1",
        "sequence": 6,
        "category": "library",
        "operation": "newfstatat",
        "resource": "/lib/aarch64-linux-gnu/libc.so.6",
        "result": {
          "kind": "success",
          "value": "0"
        },
        "details": {
          "dirfd": "3",
          "path_was_relative": true
        },
        "raw_ref": {
          "file": "trace.160",
          "line": 6
        }
      },
      {
        "schema_version": 1,
        "event_id": "bad:7",
        "process_id": "p1",
        "sequence": 7,
        "category": "permission",
        "operation": "openat",
        "resource": "$PROJECT/demos/permission-denied/locked.txt",
        "result": {
          "kind": "error",
          "code": "EACCES"
        },
        "details": {
          "dirfd": "AT_FDCWD"
        },
        "raw_ref": {
          "file": "trace.160",
          "line": 7
        }
      },
      {
        "schema_version": 1,
        "event_id": "bad:8",
        "process_id": "p1",
        "sequence": 8,
        "category": "process",
        "operation": "exit_group",
        "result": {
          "kind": "success",
          "value": "77"
        },
        "raw_ref": {
          "file": "trace.160",
          "line": 9
        }
      }
    ]
  },
  "processes": {
    "good": [
      {
        "process_id": "p1",
        "executable": "$PROJECT/demos/permission-denied/.build/permission-reader",
        "exit_code": 0
      }
    ],
    "bad": [
      {
        "process_id": "p1",
        "executable": "$PROJECT/demos/permission-denied/.build/permission-reader",
        "exit_code": 77
      }
    ]
  },
  "ignored_differences": [],
  "warnings": []
}
